id,alias,archimate_type,author,bron,created,datum_tijd_export,descr,domein_dcat,domein_gemma,gemma_guid,modified,name,name_oud,package_id,phase,status,stereotype,synoniemen,toelichting,uri,version,visibility
EAID_C5AA8835_219D_4bfa_85EF_8BA45F732BCD,,Business object,Arjen Brienen,,2018-05-29 13:54:47,28062023-11:06:06,Document waarin een heoveelheid werk is beschreven,,nan,id-c5aa8835-219d-4bfa-85ef-8ba45f732bcd,2022-12-12 16:28:27,Werkbon,Werkbon,EAPK_AAB5C359_578D_4791_B9B1_0B68629BE333,1.0,Proposed,,,,,1.0,
EAID_E71DC5EC_EEEB_4d27_A3C1_B46FD34AD41B,,Data object,aashkpour,,2021-02-11 12:34:19,28062023-11:06:06,,,nan,id-e71dc5ec-eeeb-4d27-a3c1-b46fd34ad41b,2022-12-12 16:28:27,WOZBelang,WOZ-Belang,EAPK_AAB5C359_578D_4791_B9B1_0B68629BE333,1.0,Proposed,,,,,1.0,
EAID_8D52E9F1_9CC9_42c6_A347_E68E29718E55,,Business object,Arjen Brienen,https://www.doehetzelfnotaris.nl/uitleg/zakelijk-recht/,2018-05-29 13:56:38,28062023-11:06:06,"Geeft een recht op een goed, zoals een onroerende zaak of een roerende zaak. ",,nan,id-8d52e9f1-9cc9-42c6-a347-e68e29718e55,2022-12-12 16:28:27,ZakelijkRecht,Zakelijk Recht,EAPK_AAB5C359_578D_4791_B9B1_0B68629BE333,1.0,Proposed,,,,,1.0,
EAID_7B8D0A8F_07BF_42bf_90B3_28A72BD4401A,,Business object,Arjen Brienen,,2018-05-15 09:42:06,28062023-11:06:06,Bezittingen van een onderneming op een boekhoudkundige balans,,nan,id-7b8d0a8f-07bf-42bf-90b3-28a72bd4401a,2022-12-12 16:28:27,Activa,Activa,EAPK_5FFD0C07_FF86_4896_9605_D8492189984D,1.0,Proposed,,,,,1.0,
EAID_2483BD14_7FA7_4514_A565_C7F7967E226D,,Data object,Arjen Brienen,,2018-05-15 09:48:32,28062023-11:06:06,Typering van activa,,nan,id-2483bd14-7fa7-4514-a565-c7f7967e226d,2022-12-12 16:28:27,Activasoort,Activasoort,EAPK_5FFD0C07_FF86_4896_9605_D8492189984D,1.0,Proposed,,,,,1.0,
EAID_FC698CC3_7A64_4991_A751_B3B2A5DF77E3,,Data object,Arjen Brienen,,2018-05-15 09:32:52,28062023-11:06:06,Overzicht van de bij- en afschrijvingen van een rekening,,nan,id-fc698cc3-7a64-4991-a751-b3b2a5df77e3,2022-12-12 16:28:27,Bankafschrift,Bankafschrift,EAPK_5FFD0C07_FF86_4896_9605_D8492189984D,1.0,Proposed,,,,,1.0,
EAID_764CE125_55C1_480d_90BA_745484CF3FC0,,Data object,Arjen Brienen,,2018-06-20 13:54:30,28062023-11:06:06,Een item op het bankafschrift,,nan,id-764ce125-55c1-480d-90ba-745484cf3fc0,2022-12-12 16:28:27,Bankafschriftregel,Bankafschriftregel,EAPK_5FFD0C07_FF86_4896_9605_D8492189984D,1.0,Proposed,,,,,1.0,
EAID_D87012E0_D2EB_4333_AD6C_1E43E6857304,,Business object,Arjen Brienen,,2018-05-15 09:53:35,28062023-11:06:06,Een rekening-courant bij een bank,,nan,id-d87012e0-d2eb-4333-ad6c-1e43e6857304,2022-12-12 16:28:27,Bankrekening,Bankrekening,EAPK_5FFD0C07_FF86_4896_9605_D8492189984D,1.0,Proposed,,,,,1.0,
EAID_A784A0ED_4451_4a92_B7C8_ABE528BA898F,,Business object,Arjen Brienen,,2018-05-15 10:16:46,28062023-11:06:06,Verzameling van posten die in het kader van automatische verwerking een logisch geheel vormen. ,,nan,id-a784a0ed-4451-4a92-b7c8-abe528ba898f,2022-12-12 16:28:27,Batch,Batch,EAPK_5FFD0C07_FF86_4896_9605_D8492189984D,1.0,Proposed,,,Bijvoorbeeld alle betalingen die op een dag ter verwerking in de computers aangeboden worden.,,1.0,
EAID_9F935C8B_5B7C_4ce4_9360_04A91F4F70CC,,Business object,Arjen Brienen,,2018-06-20 14:15:19,28062023-11:06:06,Een item uit een batch,,nan,id-9f935c8b-5b7c-4ce4-9360-04a91f4f70cc,2022-12-12 16:28:27,Batchregel,Batchregel,EAPK_5FFD0C07_FF86_4896_9605_D8492189984D,1.0,Proposed,,,,,1.0,
EAID_C95CF400_8487_4ff3_B475_CA1E01EBCA78,,Business object,Arjen Brienen,,2018-06-20 15:07:32,28062023-11:06:06,Een overzicht van de verwachte ontvangsten en voorziene uitgaven voor een bepaalde (meestal toekomstige) periode zodat hier een afstemming tussen plaats kan vinden om eventuele tekorten en overschotten vroegtijdig in kaart te kunnen brengen. ,,nan,id-c95cf400-8487-4ff3-b475-ca1e01ebca78,2022-12-12 16:28:27,Begroting,Begroting,EAPK_5FFD0C07_FF86_4896_9605_D8492189984D,1.0,Proposed,,,,,1.0,
EAID_87964E36_9FEE_4b8f_A053_C4EDAF000646,,Business object,Arjen Brienen,,2018-06-20 15:07:04,28062023-11:06:06,Een item op de begroting,,nan,id-87964e36-9fee-4b8f-a053-c4edaf000646,2022-12-12 16:28:27,Begrotingregel,Begrotingregel,EAPK_5FFD0C07_FF86_4896_9605_D8492189984D,1.0,Proposed,,,Een begrotingsregel betreft #. een combinatie van hoofdstuk met optioneel doelstelling met optioneel product of #. een kostenplaats met 1 of meer hoofdrekeningen,,1.0,
EAID_E74D0D46_66EB_4deb_A540_7AB08E95F956,,Business object,Arjen Brienen,,2018-05-14 14:40:52,28062023-11:06:06,Iemand aan wie een dienst of product geleverd is waardoor recht op een vergoeding is ontstaan,,nan,id-e74d0d46-66eb-4deb-a540-7ab08e95f956,2022-12-12 16:28:27,Debiteur,Debiteur,EAPK_5FFD0C07_FF86_4896_9605_D8492189984D,1.0,Proposed,,Schuldenaar,,,1.0,
EAID_2FFE3BAD_CB0E_43ea_A435_FD693B9255C3,,Data object,Arjen Brienen,,2018-06-20 14:52:02,28062023-11:06:06,Een op korte of middellange termijn nagestreefde situatie,,nan,id-2ffe3bad-cb0e-43ea-a435-fd693b9255c3,2022-12-12 16:28:27,Doelstelling,Doelstelling,EAPK_5FFD0C07_FF86_4896_9605_D8492189984D,1.0,Proposed,,,,,1.0,
EAID_E1DA56C3_6ECA_4ec9_8CF4_FC57E1C43102,,Business object,Arjen Brienen,,2018-05-14 14:38:41,28062023-11:06:06,Schriftelijke rekening of nota voor de geleverde zaken of verrichte diensten.,,nan,id-e1da56c3-6eca-4ec9-8cf4-fc57e1c43102,2022-12-12 16:28:27,Factuur,Factuur,EAPK_5FFD0C07_FF86_4896_9605_D8492189984D,1.0,Proposed,,,,,1.0,
EAID_65E960EA_CC92_4af1_AF2B_B4625FA6AEA0,,Data object,Arjen Brienen,,2018-05-14 14:49:03,28062023-11:06:06,Een item op de factuur,,nan,id-65e960ea-cc92-4af1-af2b-b4625fa6aea0,2022-12-12 16:28:27,Factuurregel,Factuurregel,EAPK_5FFD0C07_FF86_4896_9605_D8492189984D,1.0,Proposed,,,,,1.0,
EAID_0EEAF579_3F47_4551_B9F9_7367280EB3EB,,Business object,Arjen Brienen,,2018-05-14 14:24:29,28062023-11:06:06,Centrale rekening,,nan,id-0eeaf579-3f47-4551-b9f9-7367280eb3eb,2022-12-12 16:28:27,Hoofdrekening,Hoofdrekening,EAPK_5FFD0C07_FF86_4896_9605_D8492189984D,1.0,Proposed,,,,,1.0,
EAID_FFAA30D3_91C2_44aa_B52D_B21C51DB0326,,Business object,Arjen Brienen,,2018-06-20 14:50:09,28062023-11:06:06,Onderdeel van een langere tekst.,,nan,id-ffaa30d3-91c2-44aa-b52d-b21c51db0326,2022-12-12 16:28:27,Hoofdstuk,Hoofdstuk,EAPK_5FFD0C07_FF86_4896_9605_D8492189984D,1.0,Proposed,,,,,1.0,
EAID_A91E9C27_C4FA_4e1b_A4FF_8AE74ED9B7EB,,Business object,Arjen Brienen,,2018-05-15 09:47:48,28062023-11:06:06,Een opdracht (gezien vanuit de klant) voor √©√©n of meer leveringen door de leverancier aan die klant van een bepaalde hoeveelheid gespecificeerde goederen en/of diensten onder overeengekomen leveringsvoorwaarden en prijzen.,,nan,id-a91e9c27-c4fa-4e1b-a4ff-8ae74ed9b7eb,2022-12-12 16:28:27,Inkooporder,Inkooporder,EAPK_5FFD0C07_FF86_4896_9605_D8492189984D,1.0,Proposed,,,,,1.0,
EAID_D90E822D_7EF8_4ea6_AF5C_4A4362577941,,Business object,Arjen Brienen,,2018-03-21 12:25:41,28062023-11:06:06,Rekening waaraan boekingen in een financi√´le administratie samen worden toegeschreven.,,nan,id-d90e822d-7ef8-4ea6-af5c-4a4362577941,2022-12-12 16:28:27,Kostenplaats,Kostenplaats,EAPK_5FFD0C07_FF86_4896_9605_D8492189984D,1.0,Proposed,,,,,1.0,
EAID_9BC68DA7_C2A2_4585_BBF4_A4699EB6C302,,Data object,Arjen Brienen,,2018-06-20 14:38:44,28062023-11:06:06,Typering van een kostenplaats,,nan,id-9bc68da7-c2a2-4585-bbf4-a4699eb6c302,2022-12-12 16:28:27,Kostenplaatssoort,Kostenplaatssoort,EAPK_5FFD0C07_FF86_4896_9605_D8492189984D,1.0,Proposed,,,,,1.0,
EAID_CB0A6B53_D263_459e_8C28_AD97E5552FFF,,Business object,Arjen Brienen,,2018-06-20 14:17:00,28062023-11:06:06,Wijziging van een situatie,,nan,id-cb0a6b53-d263-459e-8c28-ad97e5552fff,2022-12-12 16:28:27,Mutatie,Mutatie,EAPK_5FFD0C07_FF86_4896_9605_D8492189984D,1.0,Proposed,,,"Dit kan naast getoonde mutaties nog diverse andere soorten mutaties betreffen, die handmatig worden ingevoerd, of via batches of facturen lopen: * Verkoop tot ontvangst * Inkoop tot betaling * BTW-compensatie * Vaste activa * Urenadministratie uit TIM",,1.0,
EAID_C2520FC3_622B_4edf_B911_C661B0D710FE,,Business object,Arjen Brienen,,2018-06-20 15:01:14,28062023-11:06:06,Persoon die een opdracht verstrekt. ,,nan,id-c2520fc3-622b-4edf-b911-c661b0d710fe,2022-12-12 16:28:27,Opdrachtgever,Opdrachtgever,EAPK_5FFD0C07_FF86_4896_9605_D8492189984D,1.0,Proposed,,,,,1.0,
EAID_9ABE303F_1E8D_407c_BBB8_E7DAC383E0C3,,Business object,Arjen Brienen,,2018-06-20 15:01:30,28062023-11:06:06,Partij die een opdracht aanvaardt. ,,nan,id-9abe303f-1e8d-407c-bbb8-e7dac383e0c3,2022-12-12 16:28:27,Opdrachtnemer,Opdrachtnemer,EAPK_5FFD0C07_FF86_4896_9605_D8492189984D,1.0,Proposed,,,,,1.0,
EAID_04439F81_75DB_45cf_BE7A_352A54A95D73,,Data object,Arjen Brienen,,2018-06-20 14:52:11,28062023-11:06:06,Het resultaat van een proces dat in het economisch verkeer een waarde bezit.,,nan,id-04439f81-75db-45cf-be7a-352a54a95d73,2022-12-12 16:28:28,Product,Product,EAPK_5FFD0C07_FF86_4896_9605_D8492189984D,1.0,Proposed,,,,,1.0,
EAID_1EC60172_CB6B_40c9_9818_C7A708C8540E,,Data object,Arjen Brienen,,2018-06-20 14:30:43,28062023-11:06:06,Ondergeschikte rekening van een hoofdrekening,,nan,id-1ec60172-cb6b-40c9-9818-c7a708c8540e,2022-12-12 16:28:28,Subrekening,Subrekening,EAPK_5FFD0C07_FF86_4896_9605_D8492189984D,1.0,Proposed,,,,,1.0,
EAID_E81C0FA0_2203_489a_98E9_32F1CB200E75,,Data object,aashkpour,https://buren.begroting-2020.nl/p11385/wat-is-een-taakveld,2022-08-23 17:08:18,28062023-11:06:06,Een samenhangend geheel van activiteiten en taken en hangt onder een programma.,,nan,id-e81c0fa0-2203-489a-98e9-32f1cb200e75,2023-07-24 10:48:51,Taakveld,Taakveld,EAPK_5FFD0C07_FF86_4896_9605_D8492189984D,1.0,Proposed,,,Een taakveld kan verbonden zijn aan een strategische opgave. Dat betekent dat het budget voor de activiteiten die nodig zijn om de opgave uit te voeren daar te vinden zijn.,,1.0,
EAID_4AF7FA48_DFB0_474f_B797_A13D5FD37530,,Business object,Arjen Brienen,,2018-06-20 14:30:34,28062023-11:06:06,Opdracht voor de uitvoering van een activiteit of een stap in een proces.,,nan,id-4af7fa48-dfb0-474f-b797-a13d5fd37530,2022-12-12 16:28:28,Werkorder,Werkorder,EAPK_5FFD0C07_FF86_4896_9605_D8492189984D,1.0,Proposed,,,,,1.0,
EAID_CD79FE96_BD24_406c_8D57_7974BFADD3A1,,,,,,,,,,,,$help://domain_model_pattern.Htm,$help://domain_model_pattern.htm,EAPK_1825F01E_BA3C_4e53_B3B3_BD1E69F94A10,,,,,,,,
EAID_F95E3068_5FAA_47a4_995F_5B9ADF2FA2C7,,Business object,Arjen Brienen,https://www.begrippenxl.nl/bv/nl/page/Dienstverband,2018-06-12 16:10:59,28062023-11:06:06,De rechtsbetrekking tussen werkgever en werknemer zoals vastgelegd in een arbeidsovereenkomst.,,nan,id-f95e3068-5faa-47a4-995f-5b9adf2fa2c7,2022-12-12 16:28:28,Aanstelling,Aanstelling,EAPK_9ADEFB08_F150_4278_8D32_32465C57E8A7,1.0,Proposed,,Dienstverband,,,1.0,
EAID_2A0CC803_9017_4fad_99B5_9347623090F5,,Business object,Arjen Brienen,https://onderwijsbegrippen.nl/fora-owb/nl/page/7cb7ef6a-3803-4438-aa29-a7e7c4015306,2018-04-04 16:57:17,28062023-11:06:06,Beoordeling is het oordeel van de professional over het functioneren van een leerling,,nan,id-2a0cc803-9017-4fad-99b5-9347623090f5,2022-12-12 16:28:28,Beoordeling,Beoordeling,EAPK_9ADEFB08_F150_4278_8D32_32465C57E8A7,1.0,Proposed,,,,,1.0,
EAID_E611CEB2_F4FA_49e2_AA6B_B380BC1918AC,,Data object,Arjen Brienen,,2018-06-12 16:24:09,28062023-11:06:06,Een opgave van te vergoeden kosten.,,nan,id-e611ceb2-f4fa-49e2-aa6b-b380bc1918ac,2022-12-12 16:28:28,Declaratie,Declaratie,EAPK_9ADEFB08_F150_4278_8D32_32465C57E8A7,1.0,Proposed,,,,,1.0,
EAID_9D4FB9DF_D68A_4503_96C0_272B6777A4FC,,Data object,Arjen Brienen,,2018-06-12 16:24:23,28062023-11:06:06,Typering van een declaratie,,nan,id-9d4fb9df-d68a-4503-96c0-272b6777a4fc,2022-12-12 16:28:28,Declaratiesoort,Declaratiesoort,EAPK_9ADEFB08_F150_4278_8D32_32465C57E8A7,1.0,Proposed,,,,,1.0,
EAID_63FF86E2_1BB0_48f6_8D95_3D82E8D2FA06,,Business object,Arjen Brienen,https://www.begrippenxl.nl/bv/nl/page/Dienstverband,2018-04-04 15:27:50,28062023-11:06:06,De rechtsbetrekking tussen werkgever en werknemer zoals vastgelegd in een arbeidsovereenkomst.,,nan,id-63ff86e2-1bb0-48f6-8d95-3d82e8d2fa06,2022-12-12 16:28:28,Dienstverband,Dienstverband,EAPK_9ADEFB08_F150_4278_8D32_32465C57E8A7,1.0,Proposed,,,,,1.0,
EAID_50F3F931_38F4_4ff0_8CE4_8A51056767E0,,Business object,Arjen Brienen,,2018-06-12 16:30:20,28062023-11:06:06,"Een besluit dat wordt opgelegd wanneer een persoon zijn verplichtingen niet of niet op de juiste wijze nakomt, of zich op andere wijze misdraagt.",,nan,id-50f3f931-38f4-4ff0-8ce4-8a51056767e0,2022-12-12 16:28:28,DisciplinaireMaatregel,Disciplinaire Maatregel,EAPK_9ADEFB08_F150_4278_8D32_32465C57E8A7,1.0,Proposed,,,,,1.0,
EAID_D69EE16A_390C_4d6f_BC01_2B13FB3B22F1,,Business object,crossover,,2018-04-19 11:24:27,28062023-11:06:06,Model waarin functies van een organisatie worden beschreven.,,nan,id-d69ee16a-390c-4d6f-bc01-2b13fb3b22f1,2022-12-12 16:28:28,Functiehuis,Functiehuis,EAPK_9ADEFB08_F150_4278_8D32_32465C57E8A7,1.0,Proposed,,,,,1.0,
EAID_261363C5_1E00_4b6a_B570_2129DC044010,,Data object,Arjen Brienen,http://lod.duo.nl/term/Opleiding,2018-06-12 16:13:16,28062023-11:06:06,"Afgeronde opleiding, een samenhangend geheel van vakken, gericht op de verwezenlijking van welomschreven doelstellingen op het gebied van kennis, inzicht en vaardigheden",,nan,id-261363c5-1e00-4b6a-b570-2129dc044010,2022-12-12 16:28:28,GenotenOpleiding,Genoten Opleiding,EAPK_9ADEFB08_F150_4278_8D32_32465C57E8A7,1.0,Proposed,,,,,1.0,
EAID_41AFF74F_ADBE_4f3f_AB2F_25027A70E573,,Business object,crossover,,2018-04-19 14:48:54,28062023-11:06:06,"Een gebeurtenis met betrekking tot agressie en omvat het veroorzaken van verwondingen of schade bij mensen, dieren, of voorwerpen. ",,nan,id-41aff74f-adbe-4f3f-ab2f-25027a70e573,2022-12-12 16:28:28,Geweldsincident,Geweldsincident,EAPK_9ADEFB08_F150_4278_8D32_32465C57E8A7,1.0,Proposed,,,,,1.0,
EAID_B64178F1_7D37_4a77_BEF7_97E8C9DDA4E8,,Business object,crossover,,2018-04-23 16:11:55,28062023-11:06:06,Bedrag dat feitelijk beschikbaar gesteld wordt voor een individu om een bepaalde keus te kunnen maken,,nan,id-b64178f1-7d37-4a77-bef7-97e8c9dda4e8,2022-12-12 16:28:28,IndividueelKeuzebudget,Individueel Keuzebudget,EAPK_9ADEFB08_F150_4278_8D32_32465C57E8A7,1.0,Proposed,,,,,1.0,
EAID_B9288D01_0B8F_4f8c_BAE1_AFD1B0EF6FDF,,Data object,crossover,,2018-04-23 16:12:39,28062023-11:06:06,De daadwerkelijk uitgave van een keuzebudget,,nan,id-b9288d01-0b8f-4f8c-bae1-afd1b0ef6fdf,2022-12-12 16:28:28,KeuzebudgetBesteding,Keuzebudgetbesteding ,EAPK_9ADEFB08_F150_4278_8D32_32465C57E8A7,1.0,Proposed,,,,,1.0,
EAID_A0051651_4772_436d_9553_B432BDCE3A52,,Data object,crossover,,2018-04-23 16:15:08,28062023-11:06:06,Typering van een keuzebudgetbesteding,,nan,id-a0051651-4772-436d-9553-b432bdce3a52,2022-12-12 16:28:28,KeuzebudgetBestedingsoort,Keuzebudgetbestedingsoort,EAPK_9ADEFB08_F150_4278_8D32_32465C57E8A7,1.0,Proposed,,,,,1.0,
EAID_59F3063A_13A6_4cbc_A387_045A6B126746,,Business object,Arjen Brienen,http://lod.duo.nl/term/Onderwijsinstelling,2018-06-12 16:21:11,28062023-11:06:06,Een instituut waar onderwijs wordt gegeven.,,nan,id-59f3063a-13a6-4cbc-a387-045a6b126746,2022-12-12 16:28:28,Onderwijsinstituut,Onderwijsinstituut,EAPK_9ADEFB08_F150_4278_8D32_32465C57E8A7,1.0,Proposed,,Onderwijsinstelling,,,1.0,
EAID_E07D60DE_CD26_4cef_A18B_6F72CC76C1B6,,Business object,Arjen Brienen,http://lod.duo.nl/term/Opleiding,2018-06-12 16:12:57,28062023-11:06:06,"Een samenhangend geheel van vakken, gericht op de verwezenlijking van welomschreven doelstellingen op het gebied van kennis, inzicht en vaardigheden.",,nan,id-e07d60de-cd26-4cef-a18b-6f72cc76c1b6,2022-12-12 16:28:28,Opleiding,Opleiding,EAPK_9ADEFB08_F150_4278_8D32_32465C57E8A7,1.0,Proposed,,,,,1.0,
EAID_FE559B58_A6CD_4108_82BE_98E1AEBFD9BD,,Data object,Arjen Brienen,,2018-05-28 16:57:07,28062023-11:06:06,"Betrekking waarin personen, zaken, begrippen of grootheden van nature tot elkaar staan.",,nan,id-fe559b58-a6cd-4108-82be-98e1aebfd9bd,2022-12-12 16:28:28,Relatie,Relatie,EAPK_9ADEFB08_F150_4278_8D32_32465C57E8A7,1.0,Proposed,,,,,1.0,
EAID_131BDD67_2A31_43c5_9125_F12DE2D98D2D,,Business object,Arjen Brienen,,2018-06-04 16:29:44,28062023-11:06:06,Persoon die werk zoekt,,nan,id-131bdd67-2a31-43c5-9125-f12de2d98d2d,2022-12-12 16:28:28,Sollicitant,Sollicitant,EAPK_9ADEFB08_F150_4278_8D32_32465C57E8A7,1.0,Proposed,,,,,1.0,
EAID_3BD1368C_23F1_4f42_99DB_C81581A646A0,,Business object,crossover,,2018-04-19 11:49:11,28062023-11:06:06,Verzoek om in een functie te worden aangesteld.,,nan,id-3bd1368c-23f1-4f42-99db-c81581a646a0,2022-12-12 16:28:28,Sollicitatie,Sollicitatie,EAPK_9ADEFB08_F150_4278_8D32_32465C57E8A7,1.0,Proposed,,,,,1.0,
EAID_1D4DA0E6_DA20_4ff7_A415_B937712C6F6D,,Business object,crossover,,2018-04-19 11:55:37,28062023-11:06:06,Onderhoud tussen sollicitant en werkgever met betrekking tot een sollicatie,,nan,id-1d4da0e6-da20-4ff7-a415-b937712c6f6d,2022-12-12 16:28:28,Sollicitatiegesprek,Sollicitatiegesprek,EAPK_9ADEFB08_F150_4278_8D32_32465C57E8A7,1.0,Proposed,,,,,1.0,
EAID_B0747DFC_DFC8_4ef2_8E1E_C2E8606036FC,,Data object,Arjen Brienen,,2018-06-12 16:30:49,28062023-11:06:06,Typering van een disciplinaire maatregel,,nan,id-b0747dfc-dfc8-4ef2-8e1e-c2e8606036fc,2022-12-12 16:28:28,SoortDisciplinaireMaatregel,Soort Disciplinaire Maatregel,EAPK_9ADEFB08_F150_4278_8D32_32465C57E8A7,1.0,Proposed,,,,,1.0,
EAID_93165DEC_ECB7_4225_9484_E1727524A1B5,,Data object,Arjen Brienen,,2018-06-07 10:59:08,28062023-11:06:06,Aantal besteedde uren aan een activiteit,,nan,id-93165dec-ecb7-4225-9484-e1727524a1b5,2022-12-12 16:28:28,Uren,Uren,EAPK_9ADEFB08_F150_4278_8D32_32465C57E8A7,1.0,Proposed,,,,,1.0,
EAID_DC978807_5F36_4148_B816_D6886D026DD8,,Business object,crossover,,2018-04-19 14:40:43,28062023-11:06:06,Een arbeidsplaats binnen een bedrijf of organisatie die nog gevuld dient te worden door werkzoekenden.,,nan,id-dc978807-5f36-4148-b816-d6886d026dd8,2022-12-12 16:28:28,Vacature,Vacature,EAPK_9ADEFB08_F150_4278_8D32_32465C57E8A7,1.0,Proposed,,,,,1.0,
EAID_D04135BF_C2F0_46dd_B332_F1BE36C358EF,,Business object,crossover,https://www.begrippenxl.nl/bv/nl/page/Verlof,2018-04-19 11:32:12,28062023-11:06:06,"Een periode waarin iemand toestemming heeft om iets te doen, in het bijzonder om afwezig te zijn.",,nan,id-d04135bf-c2f0-46dd-b332-f1be36c358ef,2022-12-12 16:28:28,Verlof,Verlof,EAPK_9ADEFB08_F150_4278_8D32_32465C57E8A7,1.0,Proposed,,,,,1.0,
EAID_ED741EE1_E773_40e3_B0E6_8D9886EB792F,,Data object,crossover,,2018-04-19 11:32:24,28062023-11:06:06,Typering van verlof,,nan,id-ed741ee1-e773-40e3-b0e6-8d9886eb792f,2022-12-12 16:28:28,Verlofsoort,Verlofsoort,EAPK_9ADEFB08_F150_4278_8D32_32465C57E8A7,1.0,Proposed,,,,,1.0,
EAID_610B18E6_B675_4cc0_A883_BAB9D384C668,,Business object,crossover,,2018-04-19 11:32:37,28062023-11:06:06,Een afwezigheid van een werknemer van werk.,,nan,id-610b18e6-b675-4cc0-a883-bab9d384c668,2022-12-12 16:28:28,Verzuim,Verzuim,EAPK_9ADEFB08_F150_4278_8D32_32465C57E8A7,1.0,Proposed,,,,,1.0,
EAID_45900108_585D_45ec_A042_BF4928B7F6DC,,Data object,crossover,,2018-04-19 11:33:03,28062023-11:06:06,Typologie van verzuim,,nan,id-45900108-585d-45ec-a042-bf4928b7f6dc,2022-12-12 16:28:28,Verzuimsoort,Verzuimsoort,EAPK_9ADEFB08_F150_4278_8D32_32465C57E8A7,1.0,Proposed,,,,,1.0,
EAID_BBBB63AC_B546_409b_B6D4_53DB561253B7,,Business object,Arjen Brienen,,2018-05-28 16:55:02,28062023-11:06:06,De contractuele wederpartij van de werkgever bij de arbeidsovereenkomst.,,nan,id-bbbb63ac-b546-409b-b6d4-53db561253b7,2022-12-12 16:28:28,Werknemer,Werknemer,EAPK_9ADEFB08_F150_4278_8D32_32465C57E8A7,1.0,Proposed,,,,,1.0,
EAID_961D47A0_8BCA_48d3_B8FE_831EE78DE20F,,,,,,,,,,,,$help://domain_model_pattern.Htm,$help://domain_model_pattern.htm,EAPK_E593FB18_D458_4462_B5F2_0B37FA3AA722,,,,,,,,
EAID_44EC6082_2682_43c7_A52E_0AD05B06A046,,Business object,abrienen,https://data.crow.nl/thesaurus/term/A329D70E-12C3-47AB-8F12-7F3DBAFBA9CE,2019-11-26 15:10:12,28062023-11:06:06,"Kan een (enkel of meervoudige) onderhandse aanbesteding, of een nationale of Europese aanbesteding ",,nan,id-44ec6082-2682-43c7-a52e-0ad05b06a046,2022-12-12 16:28:28,Aanbesteding,Aanbesteding,EAPK_254CDF37_3AAB_4e0b_9F3C_2B46AAEBE2E9,1.0,Proposed,,,,,1.0,
EAID_01D90490_C76A_444a_BFCE_355AFC5FB012,,Business object,abrienen,,2019-11-26 15:14:45,28062023-11:06:06,Aanbesteding voor inhuur van personen of diensten,,nan,id-01d90490-c76a-444a-bfce-355afc5fb012,2022-12-12 16:28:28,AanbestedingInhuur,Aanbesteding Inhuur,EAPK_254CDF37_3AAB_4e0b_9F3C_2B46AAEBE2E9,1.0,Proposed,,,,,1.0,
EAID_BB135B0E_A2C2_4681_BD91_30863F8B3D70,,Business object,abrienen,,2019-11-26 15:09:54,28062023-11:06:06,Aankondiging van een Nationale of Europese aanbesteding,,nan,id-bb135b0e-a2c2-4681-bd91-30863f8b3d70,2022-12-12 16:28:28,Aankondiging,Aankondiging,EAPK_254CDF37_3AAB_4e0b_9F3C_2B46AAEBE2E9,1.0,Proposed,,"Kennisgeving, Bekendmaking",,,1.0,
EAID_33E5EA10_F43A_4966_B9C1_875F0E2C1B52,,Business object,abrienen,,2019-10-29 11:10:05,28062023-11:06:06,het betreft hier het formulier 'Aanvraag Inkooporder',,nan,id-33e5ea10-f43a-4966-b9c1-875f0e2c1b52,2022-12-12 16:28:28,AanvraagInkooporder,Aanvraag Inkooporder,EAPK_254CDF37_3AAB_4e0b_9F3C_2B46AAEBE2E9,1.0,Proposed,,,,,1.0,
EAID_6CA060D0_C5AC_4b50_8B64_00DCAEA7EF48,,Data object,abrienen,,2019-11-26 15:16:32,28062023-11:06:06,Categorie waarop leveranciers zich voor de levering van personeel voor kunnen kwalificeren,,nan,id-6ca060d0-c5ac-4b50-8b64-00dcaea7ef48,2022-12-12 16:28:28,Categorie,Categorie,EAPK_254CDF37_3AAB_4e0b_9F3C_2B46AAEBE2E9,1.0,Proposed,,,,,1.0,
EAID_9FBF9FB8_B28D_4733_8443_607B8498F446,,Business object,abrienen,,2019-10-29 10:34:40,28062023-11:06:06,Bindende overeenkomst,,nan,id-9fbf9fb8-b28d-4733-8443-607b8498f446,2022-12-12 16:28:28,Contract,Contract,EAPK_254CDF37_3AAB_4e0b_9F3C_2B46AAEBE2E9,1.0,Proposed,,,,,1.0,
EAID_6A4CF470_3B0E_4141_9DB6_C9E8A525CB49,,Business object,abrienen,https://www.pianoo.nl/nl/regelgeving/cpv-codes,2019-11-27 14:11:20,28062023-11:06:06,"De Common Procurement Vocabulary (CPV-codes) is een gemeenschappelijke woordenlijst van de EU, alle mogelijke soorten overheidsopdrachten voor diensten, leveringen en werken hebben een eigen code gekregen. Aanbestedende diensten moeten bij Europese aanbestedingen dit classificatiesysteem toepassen.",,nan,id-6a4cf470-3b0e-4141-9db6-c9e8a525cb49,2022-12-12 16:28:29,CPVCode,CPV-code,EAPK_254CDF37_3AAB_4e0b_9F3C_2B46AAEBE2E9,1.0,Proposed,,,,,1.0,
EAID_B598FF22_CDD0_486f_B528_99421D0FA608,,Data object,abrienen,,2019-11-18 15:32:41,28062023-11:06:06,Formulier ten behoeve van inhuur personeel,,nan,id-b598ff22-cdd0-486f-b528-99421d0fa608,2022-12-12 16:28:29,FormulierInhuur,Formulier Inhuur,EAPK_254CDF37_3AAB_4e0b_9F3C_2B46AAEBE2E9,1.0,Proposed,,,,,1.0,
EAID_1D87490A_9F07_424f_BE6F_5E9C11376B05,,Data object,abrienen,,2019-11-18 15:34:04,28062023-11:06:06,Formulier ten behoeve van verlenging inhuur personeel,,nan,id-1d87490a-9f07-424f-be6f-5e9c11376b05,2022-12-12 16:28:29,FormulierVerlengingInhuur,Formulier Verlenging Inhuur,EAPK_254CDF37_3AAB_4e0b_9F3C_2B46AAEBE2E9,1.0,Proposed,,,,,1.0,
EAID_3FB9B466_D147_42d7_99D1_2D14A007D16C,,Business object,abrienen,,2019-11-26 15:11:46,28062023-11:06:06,"Gunning van een (enkel of meervoudige) onderhandse aanbesteding, of een nationale of Europese aanbesteding 
Of voor levering personeel",,nan,id-3fb9b466-d147-42d7-99d1-2d14a007d16c,2022-12-12 16:28:29,Gunning,Gunning,EAPK_254CDF37_3AAB_4e0b_9F3C_2B46AAEBE2E9,1.0,Proposed,,,,,1.0,
EAID_170AF8F5_8952_407a_91C4_EAF910DE3304,,Data object,aashkpour,https://www.pianoo.nl/nl/inkoopproces/organisatie/inkooppakketten,2020-11-12 16:59:28,28062023-11:06:06,"Standaard indeling om de werken, diensten en leveringen die de aanbestedende dienst helpt bij het structureren van haar uitgaven. Samenhangende leveringen, diensten en producten zijn hierin gegroepeerd. ",,nan,id-170af8f5-8952-407a-91c4-eaf910de3304,2022-12-12 16:28:29,Inkooppakket,Inkooppakket,EAPK_254CDF37_3AAB_4e0b_9F3C_2B46AAEBE2E9,1.0,Proposed,,,,,1.0,
EAID_2902E8D6_FF16_45d6_A0A4_47E2857D2D19,,Data object,abrienen,,2019-11-26 15:11:11,28062023-11:06:06,"Inschrijving op een nationale of Europese aanbesteding 
",,nan,id-2902e8d6-ff16-45d6-a0a4-47e2857d2d19,2022-12-12 16:28:29,Inschrijving,Inschrijving,EAPK_254CDF37_3AAB_4e0b_9F3C_2B46AAEBE2E9,1.0,Proposed,,,,,1.0,
EAID_75B4E818_5ECD_45c5_98F9_66F57FC6117E,,Business object,abrienen,,2019-11-27 10:37:40,28062023-11:06:06,Iemand die een bepaalde baan of functie wil ,,nan,id-75b4e818-5ecd-45c5-98f9-66f57fc6117e,2022-12-12 16:28:29,Kandidaat,Kandidaat,EAPK_254CDF37_3AAB_4e0b_9F3C_2B46AAEBE2E9,1.0,Proposed,,Gegadigde,,,1.0,
EAID_AB2AED85_D2B0_45cf_9B1F_C6005E894494,,Data object,abrienen,,2019-11-26 15:10:32,28062023-11:06:06,Kwalifificatie voor een nationale of europese aanbesteding,,nan,id-ab2aed85-d2b0-45cf-9b1f-c6005e894494,2022-12-12 16:28:29,Kwalificatie,Kwalificatie,EAPK_254CDF37_3AAB_4e0b_9F3C_2B46AAEBE2E9,1.0,Proposed,,,,,1.0,
EAID_EA7FE08E_34F7_45d2_BE2E_E4E3B8333BF3,,Business object,Arjen Brienen,,2018-05-29 13:54:06,28062023-11:06:06,Een niet-natuurlijk persoon die een product of dienst levert aan de organisatie,,nan,id-ea7fe08e-34f7-45d2-be2e-e4e3b8333bf3,2022-12-12 16:28:29,Leverancier,Leverancier,EAPK_254CDF37_3AAB_4e0b_9F3C_2B46AAEBE2E9,1.0,Proposed,,,,,1.0,
EAID_BF21FFA3_3EA6_410a_BC65_7BE5547646B6,,Data object,abrienen,,2019-11-27 13:29:18,28062023-11:06:06,"Aanbod, aanbieding of voorstel van goederen of diensten waarin opgave is gedaan van de prijs. ",,nan,id-bf21ffa3-3ea6-410a-bc65-7be5547646b6,2022-12-12 16:28:29,Offerte,Offerte,EAPK_254CDF37_3AAB_4e0b_9F3C_2B46AAEBE2E9,1.0,Proposed,,,,,1.0,
EAID_1EF1AC66_9563_4cdd_AE78_0878D651907A,,Business object,abrienen,,2019-11-26 15:22:25,28062023-11:06:06,Aanbesteding bij inschrijving,,nan,id-1ef1ac66-9563-4cdd-ae78-0878d651907a,2022-12-12 16:28:29,Offerteaanvraag,Offerteaanvraag,EAPK_254CDF37_3AAB_4e0b_9F3C_2B46AAEBE2E9,1.0,Proposed,,,,,1.0,
